{"authority":{"aggregation_authorized":false,"attempts_per_task_id":1,"authorized_batch_count":6,"authorized_batch_ids":["M4.2-BATCH-NUC","M4.2-BATCH-MEC","M4.2-BATCH-ELE","M4.2-BATCH-AUT","M4.2-BATCH-COM","M4.2-BATCH-MPH"],"authorized_task_count":60,"authorized_task_ids":["M4.2-ELE-B-A2","M4.2-ELE-B-A1","M4.2-MEC-A-N","M4.2-NUC-A-F","M4.2-NUC-B-A1","M4.2-MPH-B-F","M4.2-MEC-A-A1","M4.2-COM-B-F","M4.2-MEC-B-F","M4.2-ELE-A-A1","M4.2-NUC-A-A1","M4.2-ELE-A-N","M4.2-COM-B-A1","M4.2-MPH-A-N","M4.2-MEC-A-A3","M4.2-AUT-B-A2","M4.2-MEC-B-A3","M4.2-AUT-B-A3","M4.2-MPH-A-A2","M4.2-ELE-A-F","M4.2-NUC-B-A3","M4.2-COM-B-A2","M4.2-MPH-A-A1","M4.2-AUT-A-A3","M4.2-AUT-B-A1","M4.2-COM-A-N","M4.2-NUC-A-A2","M4.2-COM-B-N","M4.2-COM-A-A3","M4.2-ELE-B-A3","M4.2-ELE-B-N","M4.2-AUT-A-A1","M4.2-AUT-B-N","M4.2-NUC-B-F","M4.2-MPH-A-A3","M4.2-AUT-A-A2","M4.2-NUC-A-N","M4.2-MPH-B-A2","M4.2-ELE-B-F","M4.2-MEC-B-A1","M4.2-MEC-B-A2","M4.2-COM-B-A3","M4.2-AUT-B-F","M4.2-NUC-B-A2","M4.2-NUC-A-A3","M4.2-MPH-A-F","M4.2-COM-A-A2","M4.2-COM-A-F","M4.2-MPH-B-N","M4.2-ELE-A-A3","M4.2-AUT-A-N","M4.2-COM-A-A1","M4.2-MEC-A-A2","M4.2-MEC-A-F","M4.2-MPH-B-A1","M4.2-MEC-B-N","M4.2-ELE-A-A2","M4.2-MPH-B-A3","M4.2-AUT-A-F","M4.2-NUC-B-N"],"blind_mapping_access_authorized":false,"closure_authorized":false,"cross_task_result_visibility":false,"followup_message_authorized":false,"fresh_contexts_authorized":60,"fresh_execution_authorized":true,"independent_finalizations_authorized":60,"judge_execution_authorized":false,"partial_authority_allowed":false,"repair_authorized":false,"result_write_root_prefix":"evals/m4/results/m4.2","result_writes_authorized":true,"retry_authorized":false,"threshold_claim_authorized":false,"whole_matrix_required":true},"authorization_preparation":{"accepted_candidate_head":"44e6cd611ce67f362015c431d3c1d6ba069ad345","decision":"APPROVE_M4_2_SEPARATE_AUTHORIZATION_WORK_PACKAGE_ONLY","git_blob_oid":"fe768c25100e6750ece90159d6b88109356cdf6e","path":"evals/m4/authorization/m4.2/authorization-preparation.json","raw_sha256":"573ee113c5846ace7892607f953e2bd83985a104a43d268cc63b7a7425c5950d","status":"M4_2_AUTHORIZATION_PREPARATION_PASSED_NOT_AUTHORIZED"},"authorization_token":"sha256:38722c9e4b69eaca82ef1cee292c759ac5d3e35992174f078676ec161281c14f","batch_policy":{"batch_order":["M4.2-BATCH-NUC","M4.2-BATCH-MEC","M4.2-BATCH-ELE","M4.2-BATCH-AUT","M4.2-BATCH-COM","M4.2-BATCH-MPH"],"failure_preservation_required":true,"later_batches_mutable_after_observation":false,"stop_current_batch_on_infrastructure_or_protocol_failure":true,"successor_revision_required_after_failure":true,"tasks_per_batch":10},"consumption":{"authorization_token_status":"UNCONSUMED","claim_consumes_entire_matrix_authorization":true,"claim_count":0,"launch_claim_must_be_absent":true,"launch_claim_path":"evals/m4/execution/m4.2/launch-claim.json","partial_authority_allowed":false,"second_claim_allowed":false,"successor_revision_required_after_failure":true,"terminal_failure_consumes_authority":true},"does_not_authorize":["a launch claim or consumption of this authorization","a second claim or a partial-matrix claim","a second attempt, retry, repair, continuation, or follow-up message","a task outside the frozen 60-task M4.2 matrix","cross-task or cross-arm result visibility","judge execution, blind-map access, or unblinding","result aggregation or acceptance-threshold claims","changes to cases, prompts, variants, rubric, thresholds, or randomization","M4 closure, M5, an experiment, simulation, training run, deployment, or control action"],"execution_surface":{"cross_task_result_visibility":false,"environment":"worktree","project_id":"ff35b25f-4644-41c8-9073-74c697559439","project_is_git_repository":true,"project_label":"engineering-research-copilot","starting_branch":"codex/m4-cross-engineering-forward-evaluation-m4.2-one-shot-authorization","task_context_isolation":"ONE_NEW_THREAD_PER_TASK_ID","tool":"codex_app.create_thread"},"gate_iv_b_proof":{"closure_head":"ad67a79f39685937466d3a49d30c6a5117e2810c","decision":"APPROVE_M4_2_AUTHORIZATION_PREPARATION_ONLY","git_blob_oid":"d3fe975431f2e4584a52ee5305b169f5b5d29268","path":"evals/m4/authorization/m4.2/gate-iv-b-protocol-proof.json","raw_sha256":"9d160de6893fbb6bd01158524a3a48931496b6d4cae1fdc4c9f0e736921068e0","status":"M4_2_GATE_IV_B_PROTOCOL_PROOF_PASSED_NOT_AUTHORIZED"},"milestone":"M4","model_binding":{"configured_default_required":true,"exact_model_id":"gpt-5.6-sol","model_argument_policy":"OMIT_AND_VERIFY_CONFIGURED_DEFAULT","reasoning_effort":"max","thinking_argument_policy":"OMIT_AND_VERIFY_CONFIGURED_DEFAULT"},"prelaunch_counters":{"acceptance_claims":0,"aggregation_calls":0,"authorized_tasks":0,"created_contexts":0,"dispatched_tasks":0,"finalizations":0,"judge_scores":0,"raw_model_finals":0,"repairs":0,"results_observed":0,"retries":0,"unauthorized_side_effects":0},"revision":"M4.2","schema_version":"m4.2-execution-authorization-v1","status":"AUTHORIZED_UNCONSUMED"}
